{
  "version": 1,
  "slice": "clean_scan",
  "purpose": "Printed manual rasterized at 300 DPI into an image-only PDF (no text layer).",
  "why": "OCR baseline. Gives the character error rate; also proves hidden-text detection does not fire on pages that only carry an OCR layer.",
  "documents": [
    {
      "file": "clean_scan.pdf",
      "pages": 3,
      "scan": true,
      "page_labels": [
        "1",
        "2",
        "3"
      ],
      "boilerplate": [],
      "hidden_texts": [],
      "blocks": [
        {
          "id": "b0",
          "page": 0,
          "kind": "heading",
          "text": "Manual part 1 Setup",
          "section": "Manual part 1 Setup"
        },
        {
          "id": "b1",
          "page": 0,
          "kind": "paragraph",
          "text": "The pool size of component Q001 is 40 minutes. The setting is validated before the service accepts traffic. It is documented here because several teams depend on it.",
          "section": "Manual part 1 Setup",
          "lang": "en"
        },
        {
          "id": "b2",
          "page": 0,
          "kind": "paragraph",
          "text": "The heap ceiling of component X002 is 70 minutes. It is documented here because several teams depend on it. The setting is validated before the service accepts traffic.",
          "section": "Manual part 1 Setup",
          "lang": "en"
        },
        {
          "id": "b3",
          "page": 0,
          "kind": "paragraph",
          "text": "The retry budget of component Z003 is 80 requests. Changes take effect after the next rolling restart. This value is read once at startup and can be overridden per environment.",
          "section": "Manual part 1 Setup",
          "lang": "en"
        },
        {
          "id": "b4",
          "page": 1,
          "kind": "heading",
          "text": "Manual part 2 Setup",
          "section": "Manual part 2 Setup"
        },
        {
          "id": "b5",
          "page": 1,
          "kind": "paragraph",
          "text": "The queue depth of component W004 is 33 megabytes. This value is read once at startup and can be overridden per environment. It is documented here because several teams depend on it.",
          "section": "Manual part 2 Setup",
          "lang": "en"
        },
        {
          "id": "b6",
          "page": 1,
          "kind": "paragraph",
          "text": "The cache ttl of component V005 is 20 minutes. Operators usually leave it unchanged unless the workload grows. This value is read once at startup and can be overridden per environment.",
          "section": "Manual part 2 Setup",
          "lang": "en"
        },
        {
          "id": "b7",
          "page": 1,
          "kind": "paragraph",
          "text": "The rate limit of component K006 is 94 minutes. This value is read once at startup and can be overridden per environment. Changes take effect after the next rolling restart.",
          "section": "Manual part 2 Setup",
          "lang": "en"
        },
        {
          "id": "b8",
          "page": 2,
          "kind": "heading",
          "text": "Manual part 3 Setup",
          "section": "Manual part 3 Setup"
        },
        {
          "id": "b9",
          "page": 2,
          "kind": "paragraph",
          "text": "The cache ttl of component Q007 is 41 minutes. Operators usually leave it unchanged unless the workload grows. The setting is validated before the service accepts traffic.",
          "section": "Manual part 3 Setup",
          "lang": "en"
        },
        {
          "id": "b10",
          "page": 2,
          "kind": "paragraph",
          "text": "The pool size of component X008 is 50 seconds. It is documented here because several teams depend on it. Changes take effect after the next rolling restart.",
          "section": "Manual part 3 Setup",
          "lang": "en"
        },
        {
          "id": "b11",
          "page": 2,
          "kind": "paragraph",
          "text": "The rate limit of component Z009 is 37 messages. This value is read once at startup and can be overridden per environment. Operators usually leave it unchanged unless the workload grows.",
          "section": "Manual part 3 Setup",
          "lang": "en"
        }
      ],
      "questions": [
        {
          "id": "q0",
          "question": "What is the pool size of component Q001?",
          "block_id": "b1",
          "page": 0,
          "quote": "The pool size of component Q001 is 40 minutes."
        },
        {
          "id": "q1",
          "question": "What is the heap ceiling of component X002?",
          "block_id": "b2",
          "page": 0,
          "quote": "The heap ceiling of component X002 is 70 minutes."
        },
        {
          "id": "q2",
          "question": "What is the retry budget of component Z003?",
          "block_id": "b3",
          "page": 0,
          "quote": "The retry budget of component Z003 is 80 requests."
        },
        {
          "id": "q3",
          "question": "What is the queue depth of component W004?",
          "block_id": "b5",
          "page": 1,
          "quote": "The queue depth of component W004 is 33 megabytes."
        },
        {
          "id": "q4",
          "question": "What is the cache ttl of component V005?",
          "block_id": "b6",
          "page": 1,
          "quote": "The cache ttl of component V005 is 20 minutes."
        },
        {
          "id": "q5",
          "question": "What is the rate limit of component K006?",
          "block_id": "b7",
          "page": 1,
          "quote": "The rate limit of component K006 is 94 minutes."
        },
        {
          "id": "q6",
          "question": "What is the cache ttl of component Q007?",
          "block_id": "b9",
          "page": 2,
          "quote": "The cache ttl of component Q007 is 41 minutes."
        },
        {
          "id": "q7",
          "question": "What is the pool size of component X008?",
          "block_id": "b10",
          "page": 2,
          "quote": "The pool size of component X008 is 50 seconds."
        },
        {
          "id": "q8",
          "question": "What is the rate limit of component Z009?",
          "block_id": "b11",
          "page": 2,
          "quote": "The rate limit of component Z009 is 37 messages."
        }
      ]
    }
  ]
}
