{
  "version": 1,
  "slice": "mixed_language",
  "purpose": "English chapters with a Spanish appendix.",
  "why": "Language handling in cleanup, chunking and retrieval (questions in both languages).",
  "documents": [
    {
      "file": "mixed_language.pdf",
      "pages": 4,
      "scan": false,
      "page_labels": [
        "1",
        "2",
        "3",
        "4"
      ],
      "boilerplate": [],
      "hidden_texts": [],
      "blocks": [
        {
          "id": "b0",
          "page": 0,
          "kind": "heading",
          "text": "Chapter 1 Introduction",
          "section": "Chapter 1 Introduction",
          "lang": "en"
        },
        {
          "id": "b1",
          "page": 0,
          "kind": "paragraph",
          "text": "The queue depth of component Q001 is 85 megabytes. The setting is validated before the service accepts traffic. Operators usually leave it unchanged unless the workload grows.",
          "section": "Chapter 1 Introduction",
          "lang": "en"
        },
        {
          "id": "b2",
          "page": 0,
          "kind": "paragraph",
          "text": "The heap ceiling of component X002 is 46 records. Changes take effect after the next rolling restart. It is documented here because several teams depend on it.",
          "section": "Chapter 1 Introduction",
          "lang": "en"
        },
        {
          "id": "b3",
          "page": 1,
          "kind": "paragraph",
          "text": "The batch limit of component Z003 is 3 connections. The setting is validated before the service accepts traffic. This value is read once at startup and can be overridden per environment.",
          "section": "Chapter 1 Introduction",
          "lang": "en"
        },
        {
          "id": "b4",
          "page": 1,
          "kind": "paragraph",
          "text": "The queue depth of component W004 is 76 attempts. This value is read once at startup and can be overridden per environment. Operators usually leave it unchanged unless the workload grows.",
          "section": "Chapter 1 Introduction",
          "lang": "en"
        },
        {
          "id": "b5",
          "page": 2,
          "kind": "heading",
          "text": "Chapter 2 Usage",
          "section": "Chapter 2 Usage",
          "lang": "en"
        },
        {
          "id": "b6",
          "page": 2,
          "kind": "paragraph",
          "text": "The cache ttl of component V005 is 88 seconds. It is documented here because several teams depend on it. This value is read once at startup and can be overridden per environment.",
          "section": "Chapter 2 Usage",
          "lang": "en"
        },
        {
          "id": "b7",
          "page": 2,
          "kind": "paragraph",
          "text": "The retry budget of component K006 is 80 connections. Operators usually leave it unchanged unless the workload grows. It is documented here because several teams depend on it.",
          "section": "Chapter 2 Usage",
          "lang": "en"
        },
        {
          "id": "b8",
          "page": 3,
          "kind": "heading",
          "text": "Apéndice A Resumen en español",
          "section": "Apéndice A Resumen en español",
          "lang": "es"
        },
        {
          "id": "b9",
          "page": 3,
          "kind": "paragraph",
          "text": "El profundidad de cola del componente Q007 es 31 intentos. Este valor se lee al arrancar y puede cambiarse por entorno. Normalmente no se modifica salvo que crezca la carga.",
          "section": "Apéndice A Resumen en español",
          "lang": "es"
        },
        {
          "id": "b10",
          "page": 3,
          "kind": "paragraph",
          "text": "El límite de reintentos del componente X008 es 67 segundos. Normalmente no se modifica salvo que crezca la carga. La configuración se valida antes de aceptar tráfico.",
          "section": "Apéndice A Resumen en español",
          "lang": "es"
        },
        {
          "id": "b11",
          "page": 3,
          "kind": "paragraph",
          "text": "El límite de reintentos del componente Z009 es 68 segundos. La configuración se valida antes de aceptar tráfico. Normalmente no se modifica salvo que crezca la carga.",
          "section": "Apéndice A Resumen en español",
          "lang": "es"
        }
      ],
      "questions": [
        {
          "id": "q0",
          "question": "What is the queue depth of component Q001?",
          "block_id": "b1",
          "page": 0,
          "quote": "The queue depth of component Q001 is 85 megabytes."
        },
        {
          "id": "q1",
          "question": "What is the heap ceiling of component X002?",
          "block_id": "b2",
          "page": 0,
          "quote": "The heap ceiling of component X002 is 46 records."
        },
        {
          "id": "q2",
          "question": "What is the batch limit of component Z003?",
          "block_id": "b3",
          "page": 1,
          "quote": "The batch limit of component Z003 is 3 connections."
        },
        {
          "id": "q3",
          "question": "What is the queue depth of component W004?",
          "block_id": "b4",
          "page": 1,
          "quote": "The queue depth of component W004 is 76 attempts."
        },
        {
          "id": "q4",
          "question": "What is the cache ttl of component V005?",
          "block_id": "b6",
          "page": 2,
          "quote": "The cache ttl of component V005 is 88 seconds."
        },
        {
          "id": "q5",
          "question": "What is the retry budget of component K006?",
          "block_id": "b7",
          "page": 2,
          "quote": "The retry budget of component K006 is 80 connections."
        },
        {
          "id": "q6",
          "question": "¿Cuál es el profundidad de cola del componente Q007?",
          "block_id": "b9",
          "page": 3,
          "quote": "El profundidad de cola del componente Q007 es 31 intentos."
        },
        {
          "id": "q7",
          "question": "¿Cuál es el límite de reintentos del componente X008?",
          "block_id": "b10",
          "page": 3,
          "quote": "El límite de reintentos del componente X008 es 67 segundos."
        },
        {
          "id": "q8",
          "question": "¿Cuál es el límite de reintentos del componente Z009?",
          "block_id": "b11",
          "page": 3,
          "quote": "El límite de reintentos del componente Z009 es 68 segundos."
        }
      ]
    }
  ]
}
