{
  "version": 1,
  "slice": "phone_photo",
  "purpose": "The same kind of page photographed with a phone: skewed, shadowed and noisy.",
  "why": "OCR robustness. Page deskew and denoise must not lose text.",
  "documents": [
    {
      "file": "phone_photo.pdf",
      "pages": 3,
      "scan": true,
      "page_labels": [
        "1",
        "2",
        "3"
      ],
      "boilerplate": [],
      "hidden_texts": [],
      "blocks": [
        {
          "id": "b0",
          "page": 0,
          "kind": "heading",
          "text": "Manual part 1 Setup",
          "section": "Manual part 1 Setup"
        },
        {
          "id": "b1",
          "page": 0,
          "kind": "paragraph",
          "text": "The retry budget of component Q001 is 87 messages. Changes take effect after the next rolling restart. The setting is validated before the service accepts traffic.",
          "section": "Manual part 1 Setup",
          "lang": "en"
        },
        {
          "id": "b2",
          "page": 0,
          "kind": "paragraph",
          "text": "The pool size of component X002 is 62 megabytes. Changes take effect after the next rolling restart. Operators usually leave it unchanged unless the workload grows.",
          "section": "Manual part 1 Setup",
          "lang": "en"
        },
        {
          "id": "b3",
          "page": 0,
          "kind": "paragraph",
          "text": "The pool size of component Z003 is 4 minutes. The setting is validated before the service accepts traffic. Changes take effect after the next rolling restart.",
          "section": "Manual part 1 Setup",
          "lang": "en"
        },
        {
          "id": "b4",
          "page": 1,
          "kind": "heading",
          "text": "Manual part 2 Setup",
          "section": "Manual part 2 Setup"
        },
        {
          "id": "b5",
          "page": 1,
          "kind": "paragraph",
          "text": "The queue depth of component W004 is 97 seconds. Changes take effect after the next rolling restart. This value is read once at startup and can be overridden per environment.",
          "section": "Manual part 2 Setup",
          "lang": "en"
        },
        {
          "id": "b6",
          "page": 1,
          "kind": "paragraph",
          "text": "The rate limit of component V005 is 65 seconds. Operators usually leave it unchanged unless the workload grows. This value is read once at startup and can be overridden per environment.",
          "section": "Manual part 2 Setup",
          "lang": "en"
        },
        {
          "id": "b7",
          "page": 1,
          "kind": "paragraph",
          "text": "The batch limit of component K006 is 84 connections. Changes take effect after the next rolling restart. It is documented here because several teams depend on it.",
          "section": "Manual part 2 Setup",
          "lang": "en"
        },
        {
          "id": "b8",
          "page": 2,
          "kind": "heading",
          "text": "Manual part 3 Setup",
          "section": "Manual part 3 Setup"
        },
        {
          "id": "b9",
          "page": 2,
          "kind": "paragraph",
          "text": "The queue depth of component Q007 is 82 connections. Changes take effect after the next rolling restart. This value is read once at startup and can be overridden per environment.",
          "section": "Manual part 3 Setup",
          "lang": "en"
        },
        {
          "id": "b10",
          "page": 2,
          "kind": "paragraph",
          "text": "The timeout of component X008 is 70 connections. Changes take effect after the next rolling restart. This value is read once at startup and can be overridden per environment.",
          "section": "Manual part 3 Setup",
          "lang": "en"
        },
        {
          "id": "b11",
          "page": 2,
          "kind": "paragraph",
          "text": "The queue depth of component Z009 is 12 messages. The setting is validated before the service accepts traffic. This value is read once at startup and can be overridden per environment.",
          "section": "Manual part 3 Setup",
          "lang": "en"
        }
      ],
      "questions": [
        {
          "id": "q0",
          "question": "What is the retry budget of component Q001?",
          "block_id": "b1",
          "page": 0,
          "quote": "The retry budget of component Q001 is 87 messages."
        },
        {
          "id": "q1",
          "question": "What is the pool size of component X002?",
          "block_id": "b2",
          "page": 0,
          "quote": "The pool size of component X002 is 62 megabytes."
        },
        {
          "id": "q2",
          "question": "What is the pool size of component Z003?",
          "block_id": "b3",
          "page": 0,
          "quote": "The pool size of component Z003 is 4 minutes."
        },
        {
          "id": "q3",
          "question": "What is the queue depth of component W004?",
          "block_id": "b5",
          "page": 1,
          "quote": "The queue depth of component W004 is 97 seconds."
        },
        {
          "id": "q4",
          "question": "What is the rate limit of component V005?",
          "block_id": "b6",
          "page": 1,
          "quote": "The rate limit of component V005 is 65 seconds."
        },
        {
          "id": "q5",
          "question": "What is the batch limit of component K006?",
          "block_id": "b7",
          "page": 1,
          "quote": "The batch limit of component K006 is 84 connections."
        },
        {
          "id": "q6",
          "question": "What is the queue depth of component Q007?",
          "block_id": "b9",
          "page": 2,
          "quote": "The queue depth of component Q007 is 82 connections."
        },
        {
          "id": "q7",
          "question": "What is the timeout of component X008?",
          "block_id": "b10",
          "page": 2,
          "quote": "The timeout of component X008 is 70 connections."
        },
        {
          "id": "q8",
          "question": "What is the queue depth of component Z009?",
          "block_id": "b11",
          "page": 2,
          "quote": "The queue depth of component Z009 is 12 messages."
        }
      ]
    }
  ]
}
